{
  "id": "4bd47e7a-3a4f-4e6b-b8e2-5d7a2bcf5678",
  "organization_id": "9b1deb4d-3b7d-4bad-9bdd-2b0d7b3dcb6d",
  "name": "TD3 Passport Digital Handoff Application",
  "credential_template_id": "4bd47e7a-3a4f-4e6b-b8e2-5d7a2bcf1234",
  "approval_strategy": "MANUAL",
  "status": "DRAFT",
  "created_at": "2026-09-27T00:00:00Z"
}
